{"schema":"lockwood.cleanup-authorization-request/v1","target":{"schema":"lockwood.cleanup-authorization-target/v1","kind":"artifact-blob","action":"cleanup-delete","artifact_digest":"sha256:aaaaaaaaaaaaaaaaaaaaaaaaaaaaaaaaaaaaaaaaaaaaaaaaaaaaaaaaaaaaaaaa","cleanup_plan_digest":"sha256:bbbbbbbbbbbbbbbbbbbbbbbbbbbbbbbbbbbbbbbbbbbbbbbbbbbbbbbbbbbbbbbb","plan_as_of":"2026-09-17T12:00:00Z"},"policy":{"schema":"lockwood.cleanup-policy-reference/v1","target_digest":"sha256:aaaaaaaaaaaaaaaaaaaaaaaaaaaaaaaaaaaaaaaaaaaaaaaaaaaaaaaaaaaaaaaa","policy_id":"governance.cleanup","policy_version":"v1","snapshot_digest":"sha256:dddddddddddddddddddddddddddddddddddddddddddddddddddddddddddddddd","retention_rule":"orphan-grace-v1","source_timestamp":"2026-09-17T12:00:00Z","expires_at":"2026-09-17T14:00:00Z","evaluated_at":"2026-09-17T12:30:00Z","status":"complete"},"hold":{"schema":"lockwood.cleanup-hold-reference/v1","target_digest":"sha256:aaaaaaaaaaaaaaaaaaaaaaaaaaaaaaaaaaaaaaaaaaaaaaaaaaaaaaaaaaaaaaaa","snapshot_digest":"sha256:ffffffffffffffffffffffffffffffffffffffffffffffffffffffffffffffff","decision":"not-held","evaluated_at":"2026-09-17T12:30:00Z","status":"complete"},"handoff":{"schema":"lockwood.authorization-handoff/v1","target":{"kind":"artifact-blob","digest":"sha256:1111111111111111111111111111111111111111111111111111111111111111"},"action":"cleanup-delete","principal":{"authority":"amber","reference":"amber:principal:cleanup-0001"},"authorization":{"authority":"governance.example","decision":"authorized","assertion_digest":"sha256:cccccccccccccccccccccccccccccccccccccccccccccccccccccccccccccccc","policy_digest":"sha256:dddddddddddddddddddddddddddddddddddddddddddddddddddddddddddddddd","issued_at":"2026-09-17T12:00:00Z","not_before":"2026-09-17T12:00:00Z","expires_at":"2026-09-17T13:00:00Z","revocation_snapshot_digest":"sha256:eeeeeeeeeeeeeeeeeeeeeeeeeeeeeeeeeeeeeeeeeeeeeeeeeeeeeeeeeeeeeeee"}},"evaluated_at":"2026-09-17T12:30:00Z"}
